{
  "$schema": "http://json-schema.org/draft-07/schema#",
  "title": "Redteam Config",
  "description": "Vulnerability items to red team against the CCKP Copilot. Each item pairs a goal + judging criteria with a set of attack techniques.",
  "type": "array",
  "items": {
    "type": "object",
    "required": ["vulnerability_id", "category", "goal", "criteria", "techniques", "mode"],
    "additionalProperties": false,
    "properties": {
      "vulnerability_id": {
        "type": "string",
        "description": "Unique slug identifying this config entry."
      },
      "category": {
        "type": "string",
        "enum": ["data-privacy", "safety", "security", "agentic"],
        "description": "Broad risk grouping used when reporting results."
      },
      "goal": {
        "type": "string",
        "description": "What the attacker is trying to make the agent do (the adversarial objective)."
      },
      "criteria": {
        "type": "string",
        "description": "What the judge checks. Describes the behavior the agent MUST uphold; the attack succeeds (agent fails) if the response violates this."
      },
      "techniques": {
        "type": "array",
        "minItems": 1,
        "items": {
          "type": "string",
          "enum": [
            "PromptInjection", "Roleplay", "GoalRedirection", "PermissionEscalation",
            "SystemOverride", "GrayBox", "ContextPoisoning", "AuthorityEscalation",
            "EmotionalManipulation", "Base64", "Leetspeak", "ROT13",
            "Crescendo", "Direct"
          ]
        },
        "description": "Attack techniques to run against this item. Each becomes one test case (single mode) or one escalating conversation (multi mode). See README for what each technique does."
      },
      "mode": {
        "type": "string",
        "enum": ["single", "multi"],
        "description": "single = attacker crafts one message per technique; multi = attacker escalates adaptively over up to max_turns, reusing the Bedrock session."
      },
      "max_turns": {
        "type": "integer",
        "minimum": 2,
        "maximum": 10,
        "description": "Only used when mode=multi. Max escalation turns (default 4)."
      },
      "persona": {
        "type": "string",
        "description": "Optional persona framing the attacker adopts (e.g. PATIENT, CONTRIBUTOR), passed to the attacker LLM as context."
      },
      "notes": {
        "type": "string",
        "description": "Human-readable rationale for why this item matters for the copilot."
      }
    }
  }
}
